a_id,a_text,q_id,score
125-q_81,This is the Quick Access Bar. The first button the Save button allows you to save your progress.,q_81,correct
13-q_81,a. The picture in Figure X is the quick access toolbar. b. The first element is the save button and it allows you to keep your work intact so if your computer runs out of battery you can open the file to the last point where you saved it.,q_81,correct
17-q_81,A: This part is called quick access toolbar. B: The first one was the save button purpose of that would be save the document in to your computer.,q_81,correct
18-q_81,a) That part of Word is known as the Quick Access Toolbar b) The button that is in the shape of a floppy disk is used as the save function.,q_81,correct
19-q_81,A. This is the quick access toolbar. B. The furthest left square icon is the save icon. Clicking it allows you to quickly save the changes made to the document.,q_81,correct
203-q_81,a) Ribbon b) the save button allows you to save your work,q_81,incorrect
205-q_81,a) Ribbon b) The purpose of the first icon is to save the document as a file.,q_81,incorrect
206-q_81,a) Quick Access Toolbar b) The purpose of save is save what you write in the document.,q_81,correct
207-q_81,A) Quick access toolbar B) Undo button which is the backward arrow. This button allows you to undo something that you have done to the document.,q_81,correct
215-q_81,A) Quick access tool bar B)The button all the way on the left saves the document if you click on it.,q_81,correct
33-q_81,Ribbon area; Document area Print area Document area is the main area where users can create and edit their documents.,q_81,incorrect
38-q_81,The quick access toolbar. The button all the way on the left allows you to save the document on the spot.,q_81,correct
50-q_81,The standard tool bar is the name of the Figure X) One element is the first option which is the save icon. This icon allows you to save the file wherever you would like to.,q_81,correct
62-q_81,I can do the layout options and and when I click the image the format tab will appear in the ribbion.,q_81,incorrect
89-q_81,quick access toolbar,q_81,incorrect
94-q_81,a) Quick access toolbar b) 2nd button is undo the purpose is take a step back of edited history while editing and its the most frequency feature that people used.,q_81,correct
101-q_21,(a) The part shown is called the ribbon. (b) The tabs on the ribbon are a way of organizing the tools and options in Word each tab gives a whole new set of options.,q_21,incorrect
103-q_21,The part displayed is called Ribbon. The U/Underline button underlines text.,q_21,correct
107-q_21,It is used to control the font of your text while the size of your text too.,q_21,incorrect
10-q_21,(a) - This is the Ribbon section. (b) - The 'Bold' button in the ribbon section is used to make selected text thicker and darker so that they stand out in the text.(Example: Subject Headers Section Titles etc.),q_21,correct
115-q_21,(A)The part displayed is called the Ribbon. (B) One of the buttons provided in he image is the 'Calibi (Body)' which is known as the font button. This allows you to select from a variety of text fonts for your document.,q_21,correct
127-q_21,a) The area displayed in the image is called the ribbon. It contains tabs a number of tabs and tools which are essential for the word application. b) One element present in this area is the underline button which is displayed as an uppercase 'U' with a horizontal line under it. Its purpose is to underline any text that is selected when it is used.,q_21,correct
136-q_21,a) This part is the Ribbon. b) The underline button underlines a certain letter word or text.,q_21,correct
142-q_21,The top part of a Word document which includes the title bar and menu options can be collectively referred to as the 'Word Application Window.' This window contains the title bar displaying the document's name the menu options and various tools for working with your document.,q_21,incorrect
146-q_21,A) The menu bar B)The Font button lets you change the style of the font the size the boldness and the color of the font.,q_21,incorrect
149-q_21,A) The part displayed in Figure X is called 'Menu Bar' and it is made up of standard toolbar and formating toolbar. B) While from Home tab you can edit and change your text in simple ways from design tab however you can apply more advanced edits for example shading shaping text and shape effects and much more.,q_21,incorrect
155-q_21,(a) The ribbon (b) The Bullet button in the Home tab puts text into a bulleted list or allows you to type a bulleted list.,q_21,correct
169-q_21,a)this is a ribbon home tap. b)Bullets button locate in the top of the 'paragraph' can change the paragraph that you select into a bulleted list.,q_21,correct
172-q_21,the image in Figure X is the ribbion. this part includes the Quick access toolbar which can Save Undo and Redo the page.,q_21,incorrect
187-q_21,a) The name for the part displayed is called the Ribbon. b)In the ribbon there are multiple features that you can use such as tabs. This function allows you to organize your tools and options that word has provided for you.,q_21,incorrect
193-q_21,Purpose of the 'Home' Button: The Home button is located on the Ribbon the tabbed toolbar at the top of the Word window. Clicking the Home button will take you to the Home tab where you can find various tools and features related to text formatting paragraph formatting and basic document editing. The Home tab typically includes the following features: Font formatting options (e.g. font style size color bold italics underline). Paragraph formatting options (such as alignment line spacing bullet points numbering). Clipboard functions (e.g. cut copy paste). Styles (for example to quickly apply predefined formatting to text). Therefore the Home button allows you to access these basic text and paragraph formatting tools and features in Microsoft Word making it easier to format and edit documents efficiently.,q_21,correct
195-q_21,16a. This is the Ribbon. 16b. For example: The Bold button makes the text look bold (thicker.),q_21,correct
40-q_21,This part of the Word application window is called the ribbon. The purpose of the B button under the font is to make your text bold.,q_21,correct
52-q_21,a. File Insert Draw Design Layout. b. On the file part you can save the document to the pc.,q_21,incorrect
59-q_21,The name of this part is called the ribbon. One element of the ribbon is the Underline button which underlines the text.,q_21,correct
69-q_21,The ribbon is what is shown in the image in Figure X as it is in the top of the Word window and also composes of the window title bar. The ribbon also includes the dialog box which is an element that opens a dialog box with more options for each group.,q_21,correct
96-q_21,A) This part of the document is called the ribbon. B) In the ribbon there are tabs the tabs are a way for the ribbon to organize its many tools. Each tab has a different set of options and functions for you to use.,q_21,incorrect
97-q_21,a. The name of this part is the Ribbon. b. The U which is the underline style button can underline the text you selected.,q_21,correct
98-q_21,The name of the part displayed on Figure X is the Ribbon. The purpose of one element inside the ribbon is the letter customization. The Ribbone is where you can change the font wnat to higlight any words/phrases and change the color of words.,q_21,correct
9-q_21,a) this is called 'Ribbon'. b) the 'B' icon in the Ribbon which is the Bold option to make the text look thicker.,q_21,correct
105-q_51,(a) Ribbon (b) Styles,q_51,incorrect
112-q_51,(a)The part displayed in the window area of the Word application is called the document area. This is where the main content of the document is displayed and edited. (b)The purpose of the 'Undo' button in the document area of the Word application is to allow users to undo their most recent action or series of actions.,q_51,incorrect
119-q_51,a) Search bar b) You can use the search bar to quick access the element you want to find.,q_51,correct
121-q_51,A. The search engine to search for features. B. The search engine is used to search up for all the features that you could edit your document with.,q_51,correct
123-q_51,A. Search Box b. seach for text Navigation,q_51,correct
12-q_51,a) The name of the part displayed is the Microsoft search bar b) The purpose of the search button is to type for any feature available on Microsoft word and it find it for you instead of looking for it through the tabs. For example you may type print and it will give you the option to preview and print. This is helpful if you forgot where a certain feature is located.,q_51,correct
140-q_51,(a) This is the ribbon section of the document. (b) Here you will find the insert tab where you can change the font of the document.,q_51,incorrect
148-q_51,A. Ribbon B. The ribbon is at the top of the word window you can do many things with it for example tabs is for organizing the many tools and option Word has. Clicking each tab give you different and a whole new set of option.,q_51,incorrect
162-q_51,(a) Microsoft Search box (b) This powerful tool helps you quickly find what you're looking for from text to commands to help.,q_51,correct
218-q_51,a) This is the 'Tell me what to do' section or the Search section b) You can search up the feature or command you want to access in this section.,q_51,correct
27-q_51,(a) This is the Search Bar (also called Tell Me Box. ) (b) The Search Bar lets you search for button sand options in Word.,q_51,correct
42-q_51,,q_51,incorrect
49-q_51,a: Ribbon b: Dialog box- Clicking the small boxed-in arrow at the bottom right-hand corner of each group opens a dialog box with more options for each group,q_51,incorrect
6-q_51,I would select 'When I entered the store' and cut using (Cmnd+X) then paste it in order to create the second sentence.,q_51,incorrect
70-q_51,a) The ribbon where this search box can be located b) Tabs which are a way of organizing the many tools and options Word has that we need to use.,q_51,incorrect
79-q_51,A)Search Bar B) Helps you find characters words and phrases,q_51,correct
7-q_51,a) The Search Bar b) The Search Bar helps you to find out the icon and button in word.,q_51,correct
87-q_51,a. This is the Tell Me Box (Word's Search Box) b. The search box can help you find commands in the application.,q_51,correct
91-q_51,A)search box 'TELL ME WHAT YOU WANT TO DO' B)you can type font and look at the fonts you would like to use navigates word using word searching.,q_51,correct
108-q_63,,q_63,incorrect
116-q_63,a. status bar b. the purpose of the page count element is to show the total number og pages in the document and it shows which pahe is currently visible in the window.,q_63,correct
118-q_63,a) status bar b) word count button - displays how many words in the document,q_63,correct
134-q_63,A: Status Bar B: The read mode eliminates distractions when one reading. It also enables one to make small changes and comment in the document.,q_63,correct
137-q_63,(a) The name displayed in Figure X is status bar. (b) One purpose of the status bar is to show you the amount of words on your document.,q_63,correct
139-q_63,(a) The name of the part displayed in the image in Figure X is Status Bar. (b) We can use one tool that is inside the status bar to zoom in and zoom out our document.,q_63,correct
160-q_63,The Word application window consists of the following Document Title - Displays the name of the Word file. It will update to reflect the currently open document. Quick Access Toolbar - This toolbar contains shortcuts for Save Undo Redo and more that you can quickly access. Ribbon Tabs - These are the main tabs such as Home Insert Layout which contain the features and functionality of Word. Ribbon tab icons - On the right side of the ribbon there are icons for sharing changing case word count and more. View Button - The View button lets you switch between reading mode print layout and other views.,q_63,incorrect
164-q_63,The name of the part displayed in Figure X is the status bar. The purpose of the page count is to show you the total number of pages in the document and which page is currently visible in the window.,q_63,correct
167-q_63,6(a) Status bar (b) One element present in the status bar area is the page count; which shows the total number of pages in the document and what particular page is currently visible in the window.,q_63,correct
173-q_63,(A) This is the status bar. (B) A purpose of one element in this status bar is the 'page Count' this shows the total number of pages in the document and which page it is that the person is currently on.,q_63,correct
174-q_63,a) status bar b)WORD COUNT. displays the total number of words in the document.,q_63,correct
190-q_63,a. Figure X shows the Status bar b. The purpose of most left element is to count the pages of the Word document,q_63,correct
198-q_63,,q_63,incorrect
209-q_63,The + icon is to zoom in on the page,q_63,incorrect
221-q_63,(a) The name of the part displayed in the image in Figure X is the Status Bar. (b) One element in the status bar is the view option which allows you to see the document in different ways such as the Read Mode Page Layout and Web Layout.,q_63,correct
4-q_63,a) Part displayed in Figure X is the 'Print layout'. b) The purpose of print layout is to have a printer-friendly layout of the page. When this is selected the page will show the whole view of the page like it would when it's printed.,q_63,incorrect
54-q_63,a) This is a status bar. b) It shows you the word count on the bottom left.,q_63,correct
66-q_63,(a) this is called a status bar (b) One element on the status bar is the Zoom bar where we can adjust it either left or right to zoom in or out of the document,q_63,correct
76-q_63,(a) Status bar (b) The bar located to the right allows you to zoom in or zoom out by dragging it left or right,q_63,correct
82-q_63,(a) The status bar consists of current page total # of words spelling & grammar button language view options (Read Mode Page Layout and Web Layout) zoom-in bar and +/- buttons. (b) The spelling and grammar button serves the purpose to analyze your document and offer suggestions for spelling and grammar.,q_63,correct
84-q_63,The name of the part in Figure X is the status bar. The purpose of the page count element in the status bar is to show the number of total pages in the document and which page is currently visible.,q_63,correct
8-q_63,(a)The part in Figure X is the 'status bar' in the word document. (b) The 'page count'on the left hand side shows the page number of the current document and which page the user is currently viewing.,q_63,correct
101-q_28,,q_28,incorrect
102-q_28,a.) The name of the powerpoint object appearing in the Figure X is placeholder of the Title or Title Placeholder b.) In order to delete this object right click and select cut.,q_28,correct
104-q_28,If you already have a file open in PowerPoint you can create a new presentation by clicking File>New. You can also use the shortcut Ctrl+N,q_28,incorrect
108-q_28,,q_28,incorrect
109-q_28,a) This is the placeholder of the Title or Title placeholder shortly b)You can either right-click it and choose Cut from the short cut menu or click its boundary and then click on the DELETE key.,q_28,correct
10-q_28,(a) - This is a Title Placeholder. (b) - By right-clicking on the object and selecting the cut option you can delete the object from the slide.,q_28,correct
110-q_28,(a)-This is the placeholder of the Title or Title placeholder shortly. (b)- You can either right-click it and choose Cut from the shortcut menu or click its boundary and then click on the DELETE key.,q_28,correct
115-q_28,(A) This is the placeholder of the Title or 'Title Place Holder'. (B) To delete it you can right click it and follow up with Cut or Click on its boundary and then click on the Delete Key.,q_28,correct
116-q_28,a. the name of the object in Figure X is called the theme of the powerpoint b. to delete this object you can go and click the blank presntation option.,q_28,incorrect
117-q_28,The PowerPoint object appearing is the Title Only Slide. To remove this slide from the project look over at the thumbnail view select this thumbnail image of this slide only then hit the backspace or delete button and this slide will be erased from your project.,q_28,correct
11-q_28,a. It is the title placeholder b. You can right click on the title placeholder and then select 'Cut.',q_28,correct
122-q_28,Newer versions such as PowerPoint 2019 and 365 will take you to a menu called the backstage view to choose to open a new blank presentation or open a new presentation from a template.To open a blank presentation double-click the blank presentation option. You can also choose to select a theme for a new presentation but remember: themes can be changed at any time.f you already have a file open in PowerPoint you can create a new presentation by clicking File>New. You can also use the shortcut Ctrl+N (Cmnd+N for Mac). Once you have a new presentation open you save it the same way you would a Word or an Excel file. Refer to the Word lesson if you need a refresher,q_28,incorrect
123-q_28,A. This is a place holder for slides Title B. Anywhere on the box Boarder - Delete button on keyboard.,q_28,correct
125-q_28,The name is the Title placeholder. Right click the object and click Cut.,q_28,correct
126-q_28,a) This is called a text box b) To remove it click anywhere along the perimeter outline of the text box to select it then press the delete button on the keyboard.,q_28,correct
129-q_28,The object appearing in Figure X is a text box availble when you open a power point slide. You can right click any edge of the box and there will be an option to cut/delete/remove.,q_28,correct
12-q_28,a) This is the placeholder of the Title also know as the Title placeholder . b) You can either right-click it and choose Cut from the shortcut menu or click its boundary and then click on the delete key.,q_28,correct
133-q_28,(a) This is the placeholder of the Title or 'Title placeholder' shortly. (b) You can either right-click it and choose 'Cut' from the shortcut menu or click its boundary and then click on the DELETE key.,q_28,correct
134-q_28,A: Footer B: In the header and footer dialouge box Uncheck the boxes next to the footer to remove.,q_28,incorrect
136-q_28,a) The object appearing in Figure X is the placeholder of the Title. b) To remove this object you can click on its boundary and hit the DELETE key on your keyboard.,q_28,correct
137-q_28,(a) The name of the PowerPoint object appearing in Figure X is box. (b) To delete or remove this object you must you right click on the object and click 'cut' or 'delete',q_28,correct
139-q_28,(a) The name of the PowerPoint object appearing in the Figure X is a text box. (b) you can select the object and and click 'Backspace' button on your keyboar to delete this object.,q_28,correct
143-q_28,(A) This is called a Title place holder ot title (B) you can right click to Cut (shortcut menu) or click on it and the Delete it from the keyboard,q_28,correct
146-q_28,A- It is called the title box B- Right click then Cut,q_28,correct
14-q_28,the name of the object is the title box its where you type the title of the slide. you can click on the title box and click on the delete key.,q_28,correct
153-q_28,a) This is the placeholder of the title. b) Either right-click it and choose cut from the shortcut menu or click on the delete key on the keboard.,q_28,correct
155-q_28,(a) Title placeholder (b) Click its boundary and then click the Delete key.,q_28,correct
159-q_28,a). title only b). Move to right side(Slides pane)> Right click the slide> Click the delete slide option.,q_28,correct
161-q_28,The name of the PowerPoint object is the title slide presentation. In order to delete this object you can just click the object by right click and pressing the delete or backspace button.,q_28,correct
162-q_28,(a) This is the placeholder of the Title or Title placeholder shortly. (b) You can either right-click it and choose Cut from the shortcut menu or click its boundary and then click on the DELETE key.,q_28,correct
163-q_28,This object was the title name you can click it to enter the title name of the slide if you want to remove it you would have to click on the box and click backspace to delete it.,q_28,correct
165-q_28,this is a box for the title you click the dotten line around it and click delete on the keyboard.,q_28,correct
167-q_28,(a) The name of the PowerPoint object appearing in Figure X is a 'Title Box' or 'Title Placeholder.' (b) To delete or remove this object you can either right-click it and choose Cut from the shortcut menu or click its boundary and then click on the DELETE key.,q_28,correct
170-q_28,Title placeholder. You can delete this by right clicking it and using the drop menu that appears and selecting cut option.,q_28,correct
173-q_28,The name of the object appearing is an 'slideshow' or 'Presentation slide' to delete this object we would simply click on it and click or 'delete' button it will disappear right away.,q_28,incorrect
174-q_28,a) This is the placeholder of the Title or 'Title placeholder' shortly. (b) You can either right-click it and choose Cut from the shortcut menu or click its boundary and then click on the DELETE key.,q_28,correct
180-q_28,A. The powerpoint object in Figure X is the title placeholder where you will type in your title B. to remore it click on the boundry (the grey box around the words) and then simply press tye delete button on your keyboard,q_28,correct
185-q_28,(a) This is the placeholder of the Title or also known as 'Title placeholder' shortly. (b) You can click its boundary and then click on the DELETE key.,q_28,correct
18-q_28,a. The name of the PowerPoint object in Figure X is the Title/Title placeholder b. You can remove the object by doing the following: Click on the border of the text > right click > click cut in the drop down menu.,q_28,correct
190-q_28,a. The object is a title text box b. To delete/remove the textbox one can select the object by clicking on the outline and hitting delete on the keyboard.,q_28,correct
192-q_28,a)Title box or a textbox. b)You can click on the box outer layer and press delete.,q_28,correct
195-q_28,13a. This is the placeholder of the Title or Title placeholder shortly. 13b. You can either right-click it and choose Cut from the shortcut menu or click its boundary and then click on the DELETE key.,q_28,correct
196-q_28,(a) The name of the PowerPoint object is 'Title Placeholder' (b) To delete this object you need to click its boundary and then click on the delete key,q_28,correct
197-q_28,A) The object in Figure X is called a text box. B) To remove the textbox you can highlight the textbox then cut it.,q_28,correct
198-q_28,A) The name of the Powerpoint object appearing in the Figure X is called the placeholder of the Title or known as Title placeholder. B) You need to click to delete/remove this object by right clicking and than choose Cut from the shortcut menu or click its boundary and then click on the DELETE key.,q_28,correct
203-q_28,a)the name is Title only b) click the undo button to delete/remove it,q_28,incorrect
204-q_28,On Figure X This is the place holder of title. If you want to delete or remove it first select the box but then do double click and press delete.,q_28,correct
212-q_28,(a)The name of the PowerPoint object appearing in the Figure X is 'Placeholders'. (b) If you want to delete/ remove this object you need to select the placeholders then press the delete button.,q_28,correct
216-q_28,(a)This is the place holder of the Title or Title place holder shortly. (b)You can either right- click it and choose Cut from the short cut menu or click its boundary and then click on the DELETE key.,q_28,correct
217-q_28,Figure X shows a text box specifically a template text box meant for titles. You can get rid of the text box by clicking the box (make sure it is empty with no text) and simply clicking delete or backspace.,q_28,correct
220-q_28,A. This is a text box. B. Right clicking the box's border and selecting 'Cut' in the dialog box will delete the text box.,q_28,correct
221-q_28,(a) This is the placeholder of the Title. (b) You can click its boundary and then click on the DELETE key.,q_28,correct
24-q_28,(A)The object in Figure X is a title placeholder (B) You can hover and right click it then press cut.,q_28,correct
25-q_28,a) text box b) click on the box/object and hit delete on your keyboard.,q_28,correct
26-q_28,The name of the object in Figure X is a Title only slide. In order to delete the object I would go to the left side display of the slides right click the slide and click the Delete Slide option.,q_28,correct
27-q_28,(a) This is the place holder of the Title. (b) Two options are to right-click it and choose Cut from the shortcut menu or click its boundary and then click on the DELETE key.,q_28,correct
28-q_28,this is the placeholder of the Title or Title placeholder shortly. You can either right-click it and choose Cut from the shortcut menu or click its boundary and then click on the DELETE key.,q_28,correct
29-q_28,(a)It is a slide on a powerpoint presentation. (b)Click the slide once; press the DELETE or BACKSPACE keys on the keyboard OR Right-click the slide; click the Delete Slide option.,q_28,correct
31-q_28,A) Text box B) You can click onto the box and press the delete button.,q_28,correct
32-q_28,a) This is the title placeholder. b) You can either right-click it and choose cut from the shortcut menu or click its boundary and then click on the DELETE key on the keyboard,q_28,correct
