a_id,a_text,q_id,score
211-q_18,By selecting one of the squares in the picture you will be changing the theme of the presentation to what is selected.,q_18,correct
213-q_18,Clicking on one of these squares will change the theme of the presentation.,q_18,correct
215-q_18,Clicking on one of these options will change the theme of the presentation,q_18,correct
36-q_18,It will change the theme of the powerpoint presentation.,q_18,correct
37-q_18,Clicking on one of these squares will change the theme of the presentation.,q_18,correct
50-q_18,The color scheme for the presentation will change. Like If you click the snow color scheme all the slides will have that color scheme that will have snows in it.,q_18,correct
58-q_18,The theme of the powerpoint presentation will change.,q_18,correct
5-q_18,,q_18,incorrect
64-q_18,The theme will be changed throughout all of the slides,q_18,correct
66-q_18,By clicking on any of the squares shown in Figure X the theme of the entire powerpoint presentation changes according to the theme option chosen.,q_18,correct
74-q_18,It will change the theme of the presentation.,q_18,correct
80-q_18,The overall theme for the presentation would change (design layout).,q_18,correct
96-q_18,The squares in the figures are different themes available for your slide. The overall look and color of your slide will change according to the square you pick,q_18,correct
105-q_52,A chart,q_52,correct
108-q_52,A chart would be added to the PowerPoint slide if you clicked a option from Figure X),q_52,correct
109-q_52,A chart of the option you specify will be added to the Power Point slide.,q_52,correct
110-q_52,A chart of the option you specify will be added on the powerpoint slide,q_52,correct
111-q_52,A chart of the option you specify will be added to the PowerPoint slide.,q_52,correct
112-q_52,A chart of the option you specify will be added to the PowerPoint slide.,q_52,correct
113-q_52,it will be add one more templates to PowerPoint slide.,q_52,incorrect
115-q_52,A chart of the option you specify will be added to the PowerPoint Slide.,q_52,correct
116-q_52,you will add charts.,q_52,correct
118-q_52,A chart of the option you specify will be added to the PowerPoint slide.,q_52,correct
125-q_52,A chart of the specified option will appear on Powerpoint based on the selected option.,q_52,correct
129-q_52,You will be able to insert a chart into the powerpoint slide. It could be of any variety listed in the menu.,q_52,correct
130-q_52,it'll give the new templets file.,q_52,incorrect
131-q_52,A chart of the option you specify will be added to the PowerPoint slide.,q_52,correct
136-q_52,By clicking any of the options within the menu shown in Figure X a chart of the type you picked will be added onto the PowerPoint slide.,q_52,correct
138-q_52,A chart will be added to the powerpoint slide.,q_52,correct
140-q_52,A chart would be added to the powerpoint slide. This chart would differ depending on the option you choose.,q_52,correct
141-q_52,If the user were to click on an option from the menu in Figure X charts would be added to the PowerPoint slide apart from the other options listed in the templates button. There are other built-in objects in the templates button that the user could utilize in the PowerPoint slide.,q_52,correct
144-q_52,When clicking on the bar option on the menu a bar-graph will be added to the powerpoint slide.,q_52,correct
147-q_52,If I were to click on any option a template would be added to the PowerPoint slide by clicking on the templates option.,q_52,incorrect
148-q_52,,q_52,incorrect
149-q_52,In the Figure X we see the folder Template and different template options you can use any of those templates to add a graph of some sort it is very useful when presenting something with numbers or data involved for example it can be a chart comparing women vs men who are happy after divorcing or any other.,q_52,correct
14-q_52,if you were to click on pie then you would get a pie graph in the text box.,q_52,correct
158-q_52,If you were to click on any of those options a type of chart would be added to the presentation,q_52,correct
159-q_52,The templates will added to the PowerPoint slide. When you click on this Increase List Level button the item in the list changes its importance to 2nd level point3rd level point etc.,q_52,incorrect
163-q_52,This is insert the chart you can pick one chart template and then the chart will insert into your slide.,q_52,correct
168-q_52,This would create a chart which allows you to visually present data and information.,q_52,correct
176-q_52,A chart will be made in the slide based on the option chosen.,q_52,correct
179-q_52,A chart of the option you specify will be added to the powerpoint slide.,q_52,correct
180-q_52,A chart of the option that you chose will appear,q_52,correct
181-q_52,You would be adding a template to the Powerpoint slide,q_52,incorrect
183-q_52,A chart of the option which you specifically choose will be added to the PowerPoint slide.,q_52,correct
184-q_52,A chart of the option you specify will be added to the powerpoint.,q_52,correct
185-q_52,A chart of the option you specify will be added to the PowerPoint slide.,q_52,correct
187-q_52,,q_52,incorrect
189-q_52,If you were to click on an option from the menu in Figure X a chart of the selected type would be added to the PowerPoint slide.,q_52,correct
190-q_52,A Chart object would be added,q_52,correct
192-q_52,If you click on any of the following options it would give you want you click. For example if you click on 'pie' it would give you a pie chart. If you click on column it would give you columns. You can then edit the data.,q_52,correct
194-q_52,The slide will add the chart window of the right side in the PowerPoint presentation slide when I clicking the template in the menu.,q_52,correct
197-q_52,if you were to click on one of those buttons you would get a graph of your choosing.,q_52,correct
198-q_52,so the question is If you were to click on an option from the menu in the Figure X what kind of object would be added to the powerpoint slide is the chart of the option that I specify would be basicallybe added to the powerpoint slide.,q_52,correct
199-q_52,If I click on pie from the menu in the Figure X a pie chart will be added to the powerpoint slide.,q_52,correct
19-q_52,This menu of options shows the different types of charts available in PowerPoint. You would be able to choose the type of chart you want by selecting the one you desire.,q_52,correct
202-q_52,Figure X shows the chart tab in powerpoints Insert tab. If you were to click on the 'pie' option it would insert a pie chart that anyone is able to edit themselves.,q_52,correct
203-q_52,if you were to click on the column option it would add a column chart to the slide,q_52,correct
204-q_52,A specific chart option will be added to the powerpoint slide.,q_52,correct
205-q_52,A chart will be added to the PowerPoint slide.,q_52,correct
206-q_52,Charts with specified options will be added to the PowerPoint slide.,q_52,correct
207-q_52,A type of chart.,q_52,correct
208-q_52,A chart of the option you specify will be added to the PowerPoint slide.,q_52,correct
209-q_52,If I were to select pie a 3D style pie chart will appear on the powerpoint slide.,q_52,correct
20-q_52,A chart of the option you specify will be added to the PowerPoint slide.,q_52,correct
210-q_52,If I clicked an option from the menu shown in Figure X I would be adding a chart to my powerpoint.,q_52,correct
212-q_52,You will add a new slide and you are choosing the templates you want.,q_52,incorrect
213-q_52,A chart of the option you specify will be added to the PowerPoint slide.,q_52,correct
214-q_52,A chart of the option you specify will be added to the PowerPoint slide.,q_52,correct
216-q_52,A chart of the option you specify will be added to the PowerPoint slide.,q_52,correct
218-q_52,These are charts and the type of chart you select will be added to the Powerpoint slide.,q_52,correct
219-q_52,A chart of the option you specify will be added to the PowerPoint slide.,q_52,correct
220-q_52,Whichever option is selected a chart corresponding to that option will be inserted into the slide.,q_52,correct
23-q_52,,q_52,incorrect
25-q_52,A chart/graph.,q_52,correct
28-q_52,A chart of the option you specify will be added to the PowerPoint slide.,q_52,correct
29-q_52,A chart of the option you specify will be added to the PowerPoint slide.,q_52,correct
34-q_52,A graphic. It can be a picture video graph and etc.,q_52,incorrect
35-q_52,this is the menu to insert a graph or table to visually display information to your powerpoint you also will have to fill in numerical infomation and categories for the graph so that it displays the information.,q_52,correct
38-q_52,Insert a chart.,q_52,correct
40-q_52,If you were to click on one of the option shown in Figure X you would be inserting a chart. The type of chart inserted depends on the option you selected.,q_52,correct
42-q_52,,q_52,incorrect
46-q_52,A chart of the option you specify will be added to the PowerPoint slide.,q_52,correct
4-q_52,A chart of the option you specify will be added to the PowerPoint slide.,q_52,correct
50-q_52,If I clicked the 'line' icon. The line graph will be inserted in the poower point slide,q_52,correct
54-q_52,It would add the chart of the option you selected.,q_52,correct
56-q_52,A chart of the option you specify will be added to the PowerPointslide.,q_52,correct
57-q_52,A type of chart would be inserted depending on which one you click.,q_52,correct
64-q_52,A chart object will be inserted,q_52,correct
6-q_52,You would right click and select them all and then press the CRTL key to merge them into one object.,q_52,incorrect
71-q_52,This dialogue box comes up if you are trying to insert a chart into the slide.,q_52,correct
75-q_52,The object that would be added would be any type of CHART.,q_52,correct
78-q_52,A chart of the option you specify will be added to the PowerPoint slide.,q_52,correct
7-q_52,A chart of the option you specify will be added to the PowerPoint slide.,q_52,correct
80-q_52,A chart.,q_52,correct
82-q_52,A chart,q_52,correct
85-q_52,If you were to click on an option from the 'Recommended Charts' menu in Figure X a chart object would be added to the PowerPoint slide.,q_52,correct
86-q_52,If you click the template you can insert the chart you already have in you computer or you already have.,q_52,correct
87-q_52,A chart of the option you specify will be added to the PowerPoint slide.,q_52,correct
88-q_52,A chart of the option we specify will be added to the PowerPoint slide.,q_52,correct
89-q_52,when you click the option then the option will add to the powerpoint slide,q_52,incorrect
90-q_52,You would be adding a chart to the PowerPoint slide.,q_52,correct
93-q_52,A Chart of the option you specify will be added to the PowerPoint slide.,q_52,correct
95-q_52,By click on any option from the menu in Figure X a chart object would be added to the PowerPoint slide,q_52,correct
96-q_52,The object that would be added is a graph,q_52,correct
98-q_52,If you were to click an option from the menu in Figure X you would add a graph/chart to the powerpoint slide. As you can see a column char is listed line graph bar chart etc. all of this is used to show/analyze data.,q_52,correct
100-q_4,Layout Tab ->Margins button ->Click the 'Narrow' option.,q_4,correct
105-q_4,You click on the Page Layout Tab within the Page Setup group you will find the Margins dropdown in which you will click the arrow to access the choices. From here you choose whichever margin you want this case choose the 'Custom Margin' and change it to 0.5 all across.,q_4,correct
125-q_4,,q_4,incorrect
130-q_4,Aftre clicking on the page layout tab we can fimd the margin dropdown page and under all the margin menu there is coutom margin where we can make our margin.,q_4,incorrect
132-q_4,To change the margin size of a document you should click on the on the Page Layout tab and within the page setup group find the margins dropdown. You can select the 'Custom Margins' option to set your own margin size of 0.5 across all pages.,q_4,correct
133-q_4,,q_4,incorrect
135-q_4,First you can click Layout Tab then click Margins button then click the 'Narrow' option.,q_4,correct
140-q_4,Click on the page layout tab and select the margins option. Use the arrow to select the margin size you want in this case 0.5.,q_4,correct
141-q_4,The user should do the following: First select the text within the Word document. Second the user should click on the 'Layout' button listed above on the ribbon of the Word document. Then the user should click on the 'Margins' listed on the top left side of the word document. Lastly the user should click on 'Narrow' which alters the Margin size of the document to 0.5 inches all across.,q_4,correct
152-q_4,1)layout 2)margins 3)narrow,q_4,correct
154-q_4,First select 'Layout' 'Margins'. Then select Custom Margins. In Margins use the up and down arrows to enter the desired value. Then select 'OK' when finished.,q_4,incorrect
155-q_4,Click on the Layout tab > click on the Margins button > click on the 'Narrow' option.,q_4,correct
159-q_4,Select Layout > Margins. Select Custom Margins. In Margins use the Up and Down arrows to enter the values you want. Select OK when done.,q_4,incorrect
160-q_4,On the Layout tab in the Page Setup group click Margins and Select Custom Margins at the bottom of the menuIn the Custom Margins dialog box change the Top Bottom Left and Right margins all to 0.5 inchesand Click OK.,q_4,correct
161-q_4,,q_4,incorrect
162-q_4,Click on the Page Layout tab---> Within the Page Setup group you will find the Margins dropdown--->Click the arrow to access the menu and then select the margins you want. A drop-down menu will appear and you can select 'Narrow' from the predefined margin options. 'Narrow' corresponds to a margin size of 0.5 inches on all sides of the document.,q_4,correct
167-q_4,Go to the Layout or Page Layout tab --> Click on Margins --> Choose Custom Margins from the dropdown menu --> In the Page Setup dialog box set all margins (Top Bottom Left Right) to 0.5 inches --> Click OK .,q_4,correct
169-q_4,Layout --> Margin --> Narrow (is all 0.5in) if you want to custom you own size you can: Layout --> Margin --> Custom Margins to put you own size.,q_4,correct
170-q_4,You can do this by going to the Layout tab. Then click on Margins. Select the margin size you desire. In this case it will be narrow which is 0)5 inches. If you want to define your own margins choose Custom Margins.Finally select OK when you're done.,q_4,correct
173-q_4,To change the size of the document to 0.5 inches all across we would need to click on select layout+ Margins than select (custom margins) and click on the up and down arrows to enter the values you wants for these case 0.5),q_4,correct
174-q_4,Click on layour tab at topof word window click on margins in page steup group select custom margins. in page steup dialog box that appears enter .5 in the top bottom left and right fileds under margins. click ok to apply new margin settings to the document.,q_4,correct
175-q_4,In word you can click on the page layout tab then there you can click on the margins which is what you want to adjust. If you click on the arrow you can select the margins you want and in this case it is 0.5,q_4,correct
17-q_4,you can do so by select Layout > Marginsselect the Narrow or custom margins change everything to 0.5),q_4,correct
180-q_4,Go to the layout tab-> Margins -> then choose either narrow or you can press costom margins and change all the margins to .5),q_4,correct
184-q_4,In word if you go to layout then margins there should be a drop down menu right under margins you press on that menu then click custom margins. Make sure the bottom box is checked off for apply to whole document then change topleftbottom and right to 0.5,q_4,correct
189-q_4,Go to the Layout tab In the Page Setup group click on Margins. From the drop-down menu select Narrow. This option typically sets the margins to 0.5 inches on all sides. If 'Narrow' doesn't default to 0.5 inches or if you want to ensure custom settings choose Custom Margins at the bottom of the drop-down menu. In the Page Setup dialog box that appears manually enter '0.5' into the Top Bottom Left and Right fields. Click OK to apply,q_4,correct
190-q_4,One can go to Layout > Click the Margins dropdown > Choose narrow.,q_4,correct
19-q_4,You would click the Layout tab and then click on the Margins button. Then you would click on Narrow because it is 0.5 inches all across.,q_4,correct
1-q_4,Go on layout settings and change the margin you can edit to .5,q_4,correct
200-q_4,Click layout tab> margins and click narrow to 0.5 inches all across.,q_4,correct
202-q_4,In Microsoft Word you need to go to the Layout tab on top and click on Margins and chose the Narrow option.,q_4,correct
203-q_4,by using the ruler tool in word,q_4,incorrect
206-q_4,You can Select Layout and then Margins and then Select Custom Margins. In Marginsenter the values you want and click the OK when done.,q_4,incorrect
208-q_4,select page layout tab click margins click the arrow to access the menu and then select the margins 0.5 press OK,q_4,correct
219-q_4,You would go to layout then click margins. Next you would click the Narrow option so it can be 0.5 inches all across.,q_4,correct
45-q_4,Click layout then margins then narrow which is 0.5 inches,q_4,correct
51-q_4,One way is to go to View-> ruler and then you can move the ruler until the size of the margin is 0.5 inches. Another way is to go to Layout -> Margins -> Custom margin.,q_4,correct
58-q_4,First go to 'Layout' then click at 'Margins' and choose 'Narrow' which will set the word be the 0.5 inches all across.,q_4,correct
70-q_4,You''ll click no the page layout tab and in the page setup group you'll find the margins dropdown.,q_4,incorrect
76-q_4,Under the 'Layout' button click the 'Margin' button and select the option with 0.5 inches all across or manually change it by customizing,q_4,correct
78-q_4,Layout Tab Margins button Click the Narrow option.,q_4,correct
79-q_4,Click on the Page Layout tab,q_4,incorrect
80-q_4,You can click on Layout then click on Margins and then click on Custom Margins select OK when done.,q_4,incorrect
89-q_4,select the word then select the size u want,q_4,incorrect
91-q_4,Go to layout then click margins then choose narrow.,q_4,correct
94-q_4,select 'layout' tab -> select 'Margins' option -> select 'Narrow' format.,q_4,correct
103-q_41,1) Moving the bar left or right 2) On view tab in zoom group click zoom to 100%,q_41,correct
106-q_41,Two ways to change the zoom is by dragging the zoom slider on the bottom until 100% is displayed and another way is to click on view tab then click 100% button.,q_41,correct
108-q_41,one way is to go to the status bar and click the zoom slider at the bottom right side of the Word application. another way is to select the 'View' tab then click the 'Zoom' button located in the 'Zoom' group.,q_41,correct
130-q_41,On the view tab in the zoom group click zoom 100%. In the zoom group click zoom and then enetr a percentage.,q_41,correct
140-q_41,One way is to go to the view tab select zoom and enter 100% in the percantage box. Another way is to look at the bottom right of the status bar and move the slider to 100%.,q_41,correct
156-q_41,The slider on the zoom bar on the bottom right of the screen can be used to change the zoom of the document. You can also hold ctrl-key and scroll up and down using the mouse scroll-wheel to change the zoom of the document.,q_41,correct
162-q_41,Using the Zoom Slider: In the bottom right corner of the Word window you'll find a Zoom Slider. Click on the slider and drag it to the right until it reaches 100%. Using the Zoom Dialog Box: Go to the 'View' tab in the Word ribbon.In the 'Zoom' group click on the 'Zoom' button. In the 'Zoom' dialog box that appears enter '100%' in the 'Percent' field and click 'OK.',q_41,correct
164-q_41,One way to change the zoom of a Word document 10 100% is to press ctrl + 0 (cmnd + 0 on mac) and then another way is to click zoom 100% on the View tab.,q_41,correct
168-q_41,Print Layout and Zoom.,q_41,incorrect
170-q_41,You can do this one using the scroll bar on the bottom right of the document by clicking the minus and plus signs or dragging the bar to the middle until you reach 100% another way is using the view tab then selecting the zoom option and putting it as a 100% or the 100% button right next to it.,q_41,correct
172-q_41,moving the bar to the left or right you can zoom in and out of the document or On the View tab in the Zoom group click Zoom 100%. This returns the view to 100% zoom.,q_41,correct
173-q_41,1-On the view tab on top of your computer in my case( mackbook ) ----> zoom in till you get to 100% 2-The status bar on the view options can helps us zoom in as much as we would like.,q_41,correct
180-q_41,1) In the status bar on the right side press the - or + button until it says the number on the right of it says 100% 2) Go to the view tab -> then press zoom to 100%,q_41,correct
184-q_41,You can use the zoom percentage box and the zoom slider,q_41,correct
187-q_41,You could change the zoom to 100% by moving the bar to the left or to the right from thre you can zoom in and out of the document. Another way you change the view to 100 % is by right-click on it to see a dialog menu that allows you to check the zoom view of the document.,q_41,correct
188-q_41,Two ways to change the zoom of the word document to100% is by moving the bay to the left or right which allow to zoom in and out.,q_41,incorrect
190-q_41,One the status bar one can change the zoom % to 100 or one can use CTRL + Mousewheel up or down to change the zoom,q_41,correct
196-q_41,One way to change the zoom is by moving the bar on the bottom in the middle. Another way to change the zoom is by going to the View tab and clicking zoom 100% .,q_41,correct
213-q_41,1)Use Ctrl + to zoom out. 2)Use Ctrl + 0 to return back to 100% zoom.,q_41,correct
215-q_41,You can use the zoom bar in the bottom right corner of the screen and scroll until you hit 100 percent. Click on the view button than the zoom to 100 percent button within view.,q_41,correct
21-q_41,One way to change the zoom on a word doc to click on the zoom option near the bottom right corner of the application. The other method to change the zoom is by typing in the search bar 'zoom' in the application.,q_41,correct
220-q_41,Dragging the slider at the bottom right of the status bar towards its center will change the zoom of the document to 100%. Additionally clicking on the number with the percentage of zoom which is also located in the status bar will open a dialog box with an option that may be selected to change the zoom to 100%.,q_41,correct
23-q_41,,q_41,incorrect
31-q_41,1) Moving the bar in the bottom right corner of the status bar left (to minimize it) or right (to maximize it). 2) Going to the view bar in the ribbon and clicking on the zoom option to modify it.,q_41,correct
37-q_41,1) View Tab Click the 100% button. 2) Drag the zoom slider until 100% is displayed.,q_41,correct
43-q_41,1) You can use the zoom bar on the status bar at the bottom right of the page and drag to 100%. 2)Go to the view tab select zoom and type '100' on zoom percentage.,q_41,correct
49-q_41,One way is by moving the bar to the left or right you can zoom in and out of the document. Another way is clicking view then click zoom to 100%,q_41,correct
56-q_41,1) View Tab Click the 100% button. 2) Drag the zoom slider until 100% is displayed.,q_41,correct
57-q_41,By using the slider at the bottom right of the file that you can adjust the zoom needed. You can also type in zoom in the search bar at the top of the screen then click zoom in the drop down and adjust the zoom there.,q_41,correct
60-q_41,To change the zoom of a word document to 100% you can use the status bar and click on the plus sign until it reaches 100%. Another way of changing the zoom to 100% is using the view tab and then clicking on the 100% button.,q_41,correct
68-q_41,1) Using the Zoom Slider: In Microsoft Word open your document. In the bottom right corner of the Word window you'll find a Zoom slider. It looks like a slider with a zoom percentage displayed next to it. Click on the slider and drag it to the right until it reaches 100% or you can click on the percentage value itself and type '100' to set it precisely to 100%. 2) Using the Ribbon: Open your Word document. Go to the 'View' tab in the Word ribbon at the top of the screen. In the 'Zoom' group you'll see a percentage value displayed which represents the current zoom level. Click the '100%' button to set the zoom to 100%.,q_41,correct
74-q_41,1) Use the Zoom Slider: Drag the slider to the right or left until the zoom percentage reads '100%'. 2) Use the View Tab: click to set the zoom level to 100%.,q_41,correct
76-q_41,Changing the mode or layout through view options on the Status Bar Moving the zoom bar to the left or right on the Status Bar,q_41,incorrect
86-q_41,1) you can do it by View tab in the Zoom group click Zoom 100%. This returns the view to 100% zoom 2) Also you could do it byOn the View tab in the Zoom group click Zoom and then enter a percentage or choose any other settings that you want.,q_41,correct
8-q_41,1) Go to the status bar at the bottom of the word document and move the zoom bar located on the right hand side. Adjust the view to 100% by dragging the slider to the right. 2) click on the view icon on the 'quick access tool bar' to change the zoom of the document.,q_41,correct
91-q_41,you can hold cltr then scroll the mouse wheel or you can go to view click zoom and adjust it to the way you want it.,q_41,correct
