a_id,a_text,q_id,score
102-q_33,Select the text by clicking and dragging my cursor across the words When I entered the store. I can change the paragraph by using my keyboard and using CTRL+C (on mac Cmnd+C). Then I would paste moving my cursor to the beginning of the sentence and paste it there with the following keyboard command Ctrl+V (on mac Cmnd+V),q_33,correct
105-q_33,Highlight the text 'I walked on the street' by clicking and dragging your cursor over the text. Cut the Text using Crtl+X. Move your cursor to the location after the word 'street' and paste the text you just cut by using Crtl+V.,q_33,correct
108-q_33,they could copy the desired portion and then paste it where you want to move it.,q_33,correct
109-q_33,Select the words I walked on the street and cut them (Ctrl + X on Windows or Cmnd +X on Mac.) Then move the cursor to the place before the period(.) and paste(Ctrl + V on Windows or Cmnd +V on Mac)the words you cut at that place.,q_33,correct
110-q_33,You should Select the words I walked on the street and cut them using Ctrl + X on Windows or Cmnd+X on Mac. Then move the cursor to the place before the period and paste using Ctrl + V on Windows or Cmnd+V on Mac)the words you cut at that place.,q_33,correct
111-q_33,Select the text; click and drag your cursor across the text 'When I entered the store' then click Ctrl+X (Cmnd+X) move your cursor to the new location of text then paste to the new location with Ctrl+V (Cmnd+V).,q_33,correct
113-q_33,On the Review tab click Spelling and Grammar. If Word finds a potential error the Spelling and Grammar dialog box will open and spelling errors will appear as red text and grammar errors will appear as green text. To fix an error do one of the following: Enter the correction in the box and click Change.,q_33,incorrect
119-q_33,Select the words I walked on the street and cut them (Ctrl + X on Windows or Cmnd+X on Mac.) Then move the cursor to the place before the period (.) and paste (Ctrl + V on Windows or Cmnd+V on Mac) the words you cut at that place.,q_33,correct
11-q_33,You will click hold and drag your mouse across the statement 'I walked on the street.' This will select/highlight the statement. Then on the keyboard of your Windows computer you will press Ctrl + C to copy the statement to the computers clipboard and the press backspace while the statement is still highlighted/selected. This will delete the statement. Then using your mouse click on the section between the word 'store' and the period and press the spacebar to create a space. You will then press Ctrl + V to paste the statement 'I walked on the street' after the statement 'When I entered the store' creating the new desired paragraph.,q_33,correct
122-q_33,Place your cursor at the beginning of the sentence you want to move which is 'When I entered the store.' Click and hold the left mouse button. While holding the mouse button drag the cursor to the desired location within the paragraph which is immediately after 'store' in the sentence 'I walked on the street When I entered the store.' Release the mouse button.,q_33,correct
126-q_33,Use to cursor to highlight and select the words 'When I entered the store.' Right click on the highlighted text and select 'cut' from the dropdown menu that will appear. (Alternatively use the keyboard shortcut Ctrl+X.) Use to cursor to click after the word 'store' and right click there again. From the dropdown menu select 'paste.' (Alternatively use the keyboard shortcut Ctrl+V.),q_33,correct
127-q_33,The user should highlight the words 'I walked on the street' first. Then they should right click the highlighted text and select the CUT option (or press Ctrl+x on the keyboard). They can then direct their cursor to the end of the remaining text delete the period add a space and then press Ctrl+v (or PASTE) on their keyboard to paste the cut text into that spot.,q_33,correct
134-q_33,Select the part When I walked on the street Right click and select cut . Put the cursor before the I right click and paste.,q_33,correct
139-q_33,You can select 'I walked on the street' and then right click select 'cut' After the word 'store' use Ctrl + v on the keyboard to paste it.,q_33,correct
13-q_33,You can highlight the paragraph and right click on your mouse and navigate down to 'rewrite suggestions.',q_33,incorrect
143-q_33,(ctrl+x) to cut it (ctrl+v) to paste it,q_33,correct
145-q_33,select and drag from when to store to the begining of the senetence.,q_33,correct
14-q_33,you can press enter and start another paragrahp that way.,q_33,incorrect
150-q_33,Right click desired text > select Rewrite > review the choices to rewrite in the pane that opens and select the corrected phrase.,q_33,incorrect
154-q_33,You can start by selecting the word 'I Walking on the street' then Ctrl + X on Windows or Cmnd+X on Mac. Then move the cursor to the position before the period (.) and paste the word Ctrl + V on Windows followed by the cut word at that position.,q_33,correct
15-q_33,You would have to right click the text that you want to move choose either cut or copy and right click where you want the new location of the text to be and press the paste option.,q_33,correct
161-q_33,You can first start by copying the new paragraph by highlighting the paragraph and pressing Crtl + C. Then you could highlight your old sentence and press Crtl + V which is will your new paragraph will paste.,q_33,correct
163-q_33,The way I would do is to select the text that I want to switch around and then keep clicking on the selected text then there was I-beam showing around the text and you can move the selected text to the way to want to switch around.,q_33,correct
167-q_33,Highlight the phrase I walked on the street and use the cut function (Ctrl + X for Windows or Command + X for Mac). Next place your cursor directly before the period (.) and utilize the paste command (Ctrl + V for Windows or Command + V for Mac) to insert the text you previously cut.,q_33,correct
170-q_33,Select the words I walked on the street and cut them (Ctrl + X ) Then move the cursor to the place before the period (.) and paste (Ctrl + V) the words you cut at that place.,q_33,correct
173-q_33,It can be done by moving the text that wants to be putted at the front by either coping it using (command+C) or cut in it using (Command+X) by either one of these methods we can then move our cursor to the new location we would like and for both just pasting it by doing (Command+V).,q_33,correct
183-q_33,We select the words I walked on the street then we cut them using the (Cmnd+X on Mac.) Then we will move the cursor to the place before the period (.) and then paste (Cmnd+V on Mac) the words you cut in that place.,q_33,correct
185-q_33,Select the text you like to move by clicking and drag your cursor across the text- in this case it's 'When'-> when it turns grey you can cut it using Ctrl+X (Cmnd+X) move your cursor --> then moving to the new location of text paste to the new location with Ctrl+V (Cmnd+V),q_33,correct
186-q_33,you can select from I walked to street ctrl c and then delete move the mouse to the back of store space and then ctrl v.,q_33,correct
187-q_33,The word user should select the words 'I walked on the street ' right click and select cut. Then click on store and right click and press paste.,q_33,correct
189-q_33,Place the cursor at the beginning of the word 'When' in the sentence 'When I entered the store.' Click and drag to highlight the entire sentence 'When I entered the store.' Right-click on the highlighted text and select 'Cut' from the context menu. Alternatively you can use the keyboard shortcut Ctrl+X (Cmd+X on Mac) to cut the text. Move the cursor to the end of the remaining sentence 'I walked on the street.' Right-click and select 'Paste' from the context menu to insert the cut sentence. Alternatively you can use the keyboard shortcut Ctrl+V (Cmd+V on Mac) to paste the text.,q_33,correct
190-q_33,The Word user would select the 'When I entered the store' phrase press CTRL + X and paste CTRL + V after the phrase 'I walked on the street',q_33,correct
192-q_33,You can select and move the text. First select 'I walked on the street' by dragging the cursor across it. It should be highlighted in gray to show that it was selected. Now you can press ctrl+c move your cursor to a new location in the text then press ctrl+v to paste it in the new location.\ Another way is dragging the selected paragraph or sentence into a new location.,q_33,correct
193-q_33,1 Place your cursor at the beginning of the paragraph you want to edit. In this case it was right before 'Brooklyn College.' 2 Click and drag the cursor to select the entire paragraph. The selected text should now be highlighted. 3 After selecting a paragraph start typing new text directly. As you type it will automatically replace the selected text. By following these steps you can edit an existing paragraph without deleting it and typing a new paragraph from scratch.,q_33,incorrect
194-q_33,Dragging the text of 'I walked on the street'> Right- click the text> Click cut or Ctrl+X> Move to after the word of ' Store'> Paste the 'I walked on the street'.,q_33,correct
197-q_33,A word user can use copy cut and paste commands on the sentance to fix it. They can copy the 'When I entered the store' cut it from the sentence than paste it to the front of the sentence.,q_33,correct
198-q_33,So the Word user should click to change the paragraph above into the paragraph: You can do this by just selecting the text and than click and drag your crusor across the text. You will be able to text change into When I entered the store I walked on the street.,q_33,correct
200-q_33,select text and drag to move whatever place.,q_33,correct
201-q_33,Select the part 'When I entered the store' copy it and press the delete key--> Click on the part 'I walked on the street' such as the I-beam is in front of it--> paste the text. This will change the paragraph.,q_33,correct
204-q_33,First place the cursor at the beginning of the first sentence in the paragraph. In this case it's before 'I walked.'Then click and drag your cursor to select the entire sentence including the period at the end.After selecting the sentence release the mouse button. Cut the selected text by either pressing 'Ctrl+X' on the keyboard or right-clicking the highlighted text and selecting 'Cut' from the context menu. Now place the cursor at the beginning of the second sentence before 'When.' Paste the cut text by either pressing 'Ctrl+V' on your keyboard or right-clicking and selecting 'Paste' from the context menu.,q_33,correct
210-q_33,I would click the left button on my mouse and highlight the text 'I walked on the street.' Afterwards I would right click and press the 'cut' button to cut out that text and then repaste the text between the word 'store' and the punctuation mark that ended the sentence (the period). I would do this by pressing ctrl + v.,q_33,correct
211-q_33,First you will copy When I entered the store using the control + c short cut and delete the text after. Next you will use the control + v shortcut to copy and paste the text in front of When I entered the store .,q_33,correct
212-q_33,To change the first paragraph to the second you can select the part that you want to move and cut using Ctrl+X (Cmnd+X) then paste it to the place that you want using Ctrl+V (Cmnd+V).,q_33,correct
213-q_33,Select the words I walked on the street and cut them(Ctrl +X on Windows or Cmnd + X on Mac.)Then move the cursor to the place before the period(.)and paste(Ctrl +Von Windows or Cmnd +V on Mac)the words you cut at that place.,q_33,correct
215-q_33,You select 'When I entered a store' and right click and hit cut then paste it before 'I walked on the street'. Or hit command x to cut and command v to paste,q_33,correct
216-q_33,Select the words I walked on the street and cut them(Ctrl+X on Windows or Cmnd+X on Mac.) Then move the cursor to the place before the period(.) and paste (Ctrl+V on Windows or Cmnd+V on Mac) the words you cut at that place.,q_33,correct
217-q_33,You can highlight the section 'When I entered the store' with your mouse and select cut via right clicking or using ctrl + x. Then you paste that at the front of 'I walked on the street.',q_33,correct
219-q_33,You would select the paragraph then click the Home option at the top of the document. Next you'd click editing then replace which will give you the options to replace the first paragraph with the new one.,q_33,incorrect
21-q_33,A Word user should click on the find and replace menu and from there add the word(s) they would want to replace in the text.,q_33,incorrect
23-q_33,,q_33,incorrect
29-q_33,you can highlight when I entered the store first from the first paragraph. Copy using Ctrl+C(Cmnd+C) move your cursor to the new location on the word document in the text past to the new location with Ctrl+V(Cmnd+V),q_33,correct
34-q_33,You can move the texts between pages between paragraphs or even between programs and windows. You can also drag the text to a new location within the same paragraph. You can also copy the second part and paste it in front of it.,q_33,correct
36-q_33,Select text 'I walked on the street' click it and drag it to the end but right before the period.,q_33,correct
45-q_33,Click Cntl X and then move the curser after the period then paste Cntl V,q_33,correct
48-q_33,Select the When I entered the store portion of the sentence and then copy it using Ctrl+C (Cmnd+C) the move your cursor to the new location of in front of the original sentence infront of the I then paste using Ctrl+V (Cmnd+V) and then take that already selected portion of the When I entered the store in the original position (after the word street ) and cut it using Ctrl+X (Cmnd+X),q_33,correct
50-q_33,Click and drag the text by using the cursor. you can delete or edit the text you have selected. One more way with the the right click option is to copy and paste selected text,q_33,correct
51-q_33,You can click on the Review tab Editor button and perform the correction options it gives you.,q_33,incorrect
53-q_33,In this situation word should have put and red line uner the cpatial w when because it is a grammatical mistake and when you click on the red line it will give you many other options on how to fix it and you can select the correctone.,q_33,incorrect
54-q_33,Highlight 'When I entered the store' then right click and copy the text. Delete the highlighted portion. Then paste what you highlighted in front of 'I walked on the street'.,q_33,correct
55-q_33,You can select 'When I entered the store' and drag it to the beginning of the paragraph/sentence. If there is extra space left next to street and the '.' then remove that extra space.,q_33,correct
59-q_33,A Word user can change the paragraph by using the cut and paste function. To do this the user should highlight When I entered the store and press Ctrl+X or Cmnd+X on a mac to cut the text. Afterwards the user should put the cursor before I walked and press Ctrl+V or Cmnd+V on a mac to paste the text.,q_33,correct
5-q_33,,q_33,incorrect
64-q_33,Select 'When I entered the store' cut the selected segment click the front of the sentence and paste it,q_33,correct
65-q_33,you can highlight the part you want to move and drag it with the mouse to the other side and this should give you what you want!,q_33,correct
69-q_33,I would use the copy feature by using Ctrl+C (Cmnd+C) to copy 'When I entered the store' and then paste it to the new location with Ctrl+V (Cmnd+V).,q_33,correct
70-q_33,'I walked on the street' is where you'll copy then delete it then paste it afterwards 'When I entered the store' and you'll get that paragraph,q_33,correct
72-q_33,Click and drag your cursor across the second part of text in order to select it. Copy using Ctrl+C (Cmnd+C) move your cursor to the new location (begining) of text then paste to the new location with Ctrl+V (Cmnd+V). Then cut using Ctrl+X (Cmnd+X).,q_33,correct
77-q_33,You would use your mouse and select When I entered the store without the period and then click and hold the mouse to move the select quote to the front of the sentence.,q_33,correct
80-q_33,In the second paragraph you could click Ctrl + C (second pragraph) + then click Ctrl + V to paste into new location you would like to put it. It should automatically show as second paragraph writing instead of the first paragraph.,q_33,correct
82-q_33,Right-click over the selected text When I entered the store and choose Copy . Then paste the copied text after I walked on the street by right-clicking and choosing Paste .,q_33,correct
84-q_33,In order for the word user to change the paragraph into the above paragraph you can click on home then click on replace with to see options you can replace.,q_33,incorrect
90-q_33,Click in front of 'When' and drag the cursor to select the text 'When I entered the store'. Cut using Ctrl+X click on the front of the sentence then paste the cut text with Ctrl+V,q_33,correct
91-q_33,Highlight the part When I entered the store then drag that in front of 'I walked..',q_33,correct
97-q_33,I can select the phrase When I entered the store and click it to drag the phrase to beginning of the sentence which is befote When I enter the store .,q_33,correct
98-q_33,What you can do to change the paragraph above to the paragraph below is to click and dragg your cursor across the text copy using Ctrl+c(Cmnd+c) move your cursor to the new location of the text then paste to the new location with Ctrl+V (Cmnd+V). There's also another way and it can be done by clicking the text and drag it to the new location.,q_33,correct
99-q_33,One way to change the first paragraph into the second paragraph is by selecting the word 'When' and then dragging the word in front of the letter 'I.',q_33,correct
9-q_33,1) select the text ' When I entered the store' right click and select Cut 2) place the cursor at the beginning and right click select Paste. 4) add a space between 'store' and 'I'. 3) it became 'When I entered the store I walked on the street.',q_33,correct
103-q_43,Highlight a text > Insert > Links > Hyperlink > add the hyperlink address in the address tab > click ok,q_43,correct
104-q_43,he first step use the shortcut Ctrl+K. The Text to display textbox at the top contains the text that will be formatted as a hyperlink. It can be changed from this window. The Address textbox at the bottom is where the hyperlink will send to users. Type a webpage URL or email address in the Address textbox. Click OK.,q_43,correct
108-q_43,,q_43,incorrect
111-q_43,Select the text from which you want to make a hyperlink and go to the Insert tab then Link button which is the Insert Hyperlink dialog box will open and Click OK.,q_43,correct
113-q_43,Select the text or picture that you want to display as a hyperlink. Press Ctrl+K. You can also right-click the text or picture and click Link on the shortcut menu.,q_43,correct
118-q_43,Select the text from which you want to make a hyperlink Insert tab Link button (the Insert Hyperlink dialog box will open) Click OK,q_43,correct
121-q_43,You can highlight the text select the insert tab and select insert link and put the link address into the space given.,q_43,correct
123-q_43,select the text- Iright click on mouse - Paste the link - select - ok,q_43,correct
124-q_43,I would right click the text I want to make a hyperlink and select Hyperlink.,q_43,correct
126-q_43,Using the cursor click and drag over the text to which you would like to apply the hyperlink to highlight and select it. Go to 'Insert' in the ribbon then press on 'Link.' (Alternatively use the keyboard shortcut Ctrl+K.) This will open up a new box where you can type or paste the link at hand. Press 'ok' to finalize this change.,q_43,correct
127-q_43,Highlight the text and right-click it. Select 'link' from the options presented. This will open up a window where you can direct the link to both local files as well as Online websites. In the window you can either type in the link of the website or find the website Online copy the link from there and then paste the link into the window. Press 'OK' and then you will see that the highlighted text has a link assigned to it.,q_43,correct
129-q_43,Choose the text you would like to add a hyperlink to.Right click the text and choose hyperlink.This will open the dialog box where you are able to add the url or the email address.Once you click ok the hyperlink is added.,q_43,correct
12-q_43,To add a hyperlink to existing text you first select the text that you want to turn into a hyperlink --> right-click on the text --> On the shortcut menu click Hyperlink --> In the Insert Hyperlink dialog paste the link in the Address box and click OK.,q_43,correct
136-q_43,To enter a hyperlink into an existing object you have to: Select the text you that want to make a hyperlink -> Click the Insert tab -> Click the Link button which will open the Insert Hyperlink dialog box -> Click OK.,q_43,correct
137-q_43,To enter a hyperlink into an existing text you highlight the text you wish to change into a hyperlink. Once it is highlighted right-click the selected text and select Hyperlink. After a hyperlink dialog box will appear and the text to display textbox at the top contains the text that will be formatted as a hyperlink. The Address textbox at the bottom is where the hyperlink will send users so you would type a webpage URL or email address in the Address textbox. Afterwards the text will change into a hyperlink once inserted. Then the text will appear blue and underlined to show it is now a hyperlink.,q_43,correct
139-q_43,You can select the existing text. And you should click 'insert' on the top ribbon then click 'link' button for you to insert a hyperlink.,q_43,correct
147-q_43,Selecting piece of text Open the Insert Link dialog box window by Clicking on Ctrl + K or Cmnd + K on mac. After type the webpage s address in the Address input box. Finally click OK for the link to be added to that text and to close the dialog box.,q_43,correct
148-q_43,1) Select the text that you want to change into a hyperlink. 2) right-click the mouse and then select Hyperlink. 3) and then it will allow you to add a text to a textbox 4) and that s where you will put the link 5) when the link is inserted the text will change to the hyperlink style. It will be Blue underlined.,q_43,correct
151-q_43,1) On Windows CTRL + K on Mac Command + K 2) Insert -> Hyperlink,q_43,correct
153-q_43,By selecting the text from which you want to make a hyperlink then on the insert tab. Then link button (the Insert Hyperlink dialog box will open). Then click OK.,q_43,correct
156-q_43,To enter a hyperlink into an existing file select the text you want to convert into a hyperlink go to the insert tab click on the hyperlink button in the link group enter the url to the link you want the hyperlink to navigate to.,q_43,correct
160-q_43,Display the text you want to make a link to and click the 'Insert Hyperlink' button in the toolbar. This will open a dialog box where you can enter the URL you want to link to.,q_43,correct
161-q_43,If you choose to add a hyperlink into an existing paragraph you should first go to the insert tab then the media group video and then online videos. When you are here insert the link of the online video and insert.,q_43,correct
162-q_43,Open your PowerPoint presentation. Navigate to the slide where you want to add the hyperlink to existing text. Select the text that you want to turn into a hyperlink. Click and drag to highlight the text. With the text selected right-click on it. A context menu will appearIn the context menu choose the 'Hyperlink' option. This will open the 'Insert Hyperlink' dialog box.In the 'Insert Hyperlink' dialog box you can enter the URL or web address you want to link to in the 'Address' or 'URL' field. You can also link to a specific slide within your presentation by selecting 'Place in This Document' and then choosing the slide you want to link to. After specifying the hyperlink destination click the 'OK' button to create the hyperlink. Use the shortcut Ctrl+K. Right-click the selected text and select Hyperlink Insert>Links>Hyperlink.,q_43,correct
163-q_43,Select on the text that you would want to insert the link and then insert the link then you would type the link address.,q_43,correct
169-q_43,First Select the text that you want make it become a link --> Ctrl + K --> For a link to a webpage type the webpage's address in the 'Address' input box. --> click ok the text will become a hyperlink.,q_43,correct
175-q_43,Select the existing text you can right click on the text and press the option select hyperlink and then input the link and the existing text will turn into a hyperlink.,q_43,correct
176-q_43,Select the text that will be made into a hyperlink click on the insert tab click the link button paste the link into the insert hyperlink box and click ok.,q_43,correct
177-q_43,select the text from which you want to make a hyperlink and insert tab link button(where the dialogue box will open) and click ok.,q_43,correct
180-q_43,highlight the text you want to add a hyperlink to -> go to insert tab -> press link -> a box will show uop and in the box tnext to the word address: you can insert the url of the page you want to put in.,q_43,correct
185-q_43,To add a hyperlink to a Word document select the text to be changed into a hyperlink --> Ctrl+K,q_43,correct
186-q_43,Select the text from which you want to make a hyperlink Insert tab Link button Click OK.,q_43,correct
188-q_43,Right-click on the text you wish to become a hyperlink after selecting it. Select 'Hyperlink' from the shortcut menu. Paste the URL into the Address field of the Insert Hyperlink dialog box then click OK.,q_43,correct
